{
  "schema_version": "0.1.0",
  "registry_id": "predicate_registry:v0",
  "registry_version": "0.1.0",
  "created_at": "2026-08-03T19:20:00+08:00",
  "predicates": [
    {
      "predicate_id": "metric.distance_m",
      "label_zh": "距离",
      "description": "由版本化几何或路径计算得到的距离。",
      "category": "computed_metric",
      "allowed_subject_types": ["named_route", "named_line", "climb", "classic_ride", "path", "traversal", "ride_plan"],
      "value_kind": "number",
      "unit_codes": ["m"],
      "scope_requirements": {"traversal_scope": false, "direction_scope": false, "spatial_scope": "optional", "time_window": "none"},
      "directionality": "direction_optional",
      "freshness_policy": {"policy_ref": "freshness.computed_revision.v1", "time_bound": false, "expected_statuses": ["static"], "max_age_s": null},
      "evidence_requirement": "calculation_required",
      "allowed_fact_statuses": ["computed"]
    },
    {
      "predicate_id": "metric.climb_m",
      "label_zh": "累计爬升",
      "description": "由版本化海拔输入与计算方法得到的累计爬升。",
      "category": "computed_metric",
      "allowed_subject_types": ["named_route", "named_line", "climb", "classic_ride", "path", "traversal", "ride_plan"],
      "value_kind": "number",
      "unit_codes": ["m"],
      "scope_requirements": {"traversal_scope": false, "direction_scope": false, "spatial_scope": "optional", "time_window": "none"},
      "directionality": "direction_optional",
      "freshness_policy": {"policy_ref": "freshness.computed_revision.v1", "time_bound": false, "expected_statuses": ["static"], "max_age_s": null},
      "evidence_requirement": "calculation_required",
      "allowed_fact_statuses": ["computed"]
    },
    {
      "predicate_id": "metric.descent_m",
      "label_zh": "累计下降",
      "description": "由版本化海拔输入与计算方法得到的累计下降。",
      "category": "computed_metric",
      "allowed_subject_types": ["named_route", "named_line", "climb", "classic_ride", "path", "traversal", "ride_plan"],
      "value_kind": "number",
      "unit_codes": ["m"],
      "scope_requirements": {"traversal_scope": false, "direction_scope": false, "spatial_scope": "optional", "time_window": "none"},
      "directionality": "direction_optional",
      "freshness_policy": {"policy_ref": "freshness.computed_revision.v1", "time_bound": false, "expected_statuses": ["static"], "max_age_s": null},
      "evidence_requirement": "calculation_required",
      "allowed_fact_statuses": ["computed"]
    },
    {
      "predicate_id": "metric.moving_time_range_s",
      "label_zh": "移动时间区间",
      "description": "基于版本化路径与明确骑手速度模型计算的移动时间范围。",
      "category": "computed_metric",
      "allowed_subject_types": ["named_route", "named_line", "climb", "classic_ride", "traversal", "ride_plan"],
      "value_kind": "number_range",
      "unit_codes": ["s"],
      "scope_requirements": {"traversal_scope": true, "direction_scope": true, "spatial_scope": "optional", "time_window": "optional"},
      "directionality": "direction_specific",
      "freshness_policy": {"policy_ref": "freshness.model_revision.v1", "time_bound": false, "expected_statuses": ["static", "current"], "max_age_s": null},
      "evidence_requirement": "calculation_required",
      "allowed_fact_statuses": ["computed"]
    },
    {
      "predicate_id": "route.surface_type",
      "label_zh": "路面类型",
      "description": "被证据或计算支持的主要路面类型。",
      "category": "static_curated_fact",
      "allowed_subject_types": ["named_route", "named_line", "climb", "path", "traversal", "road_section"],
      "value_kind": "enum",
      "enum_values": ["asphalt", "concrete", "compacted_gravel", "loose_gravel", "dirt", "mixed", "unknown"],
      "scope_requirements": {"traversal_scope": false, "direction_scope": false, "spatial_scope": "optional", "time_window": "none"},
      "directionality": "not_directional",
      "freshness_policy": {"policy_ref": "freshness.surface_static.v1", "time_bound": false, "expected_statuses": ["static", "stale", "unknown"], "max_age_s": null},
      "evidence_requirement": "evidence_or_calculation",
      "allowed_fact_statuses": ["computed", "accepted"]
    },
    {
      "predicate_id": "route.unpaved_distance_m",
      "label_zh": "非铺装距离",
      "description": "在明确路径范围内计算得到的非铺装距离。",
      "category": "computed_metric",
      "allowed_subject_types": ["named_route", "named_line", "classic_ride", "path", "traversal", "ride_plan"],
      "value_kind": "number",
      "unit_codes": ["m"],
      "scope_requirements": {"traversal_scope": false, "direction_scope": false, "spatial_scope": "required", "time_window": "none"},
      "directionality": "not_directional",
      "freshness_policy": {"policy_ref": "freshness.computed_revision.v1", "time_bound": false, "expected_statuses": ["static"], "max_age_s": null},
      "evidence_requirement": "calculation_required",
      "allowed_fact_statuses": ["computed"]
    },
    {
      "predicate_id": "route.bicycle_access",
      "label_zh": "自行车通行性",
      "description": "在明确空间范围内，经来源支持的自行车通行规则。",
      "category": "static_curated_fact",
      "allowed_subject_types": ["named_route", "named_line", "path", "traversal", "road_section"],
      "value_kind": "enum",
      "enum_values": ["permitted", "restricted", "prohibited", "unknown"],
      "scope_requirements": {"traversal_scope": false, "direction_scope": false, "spatial_scope": "required", "time_window": "optional"},
      "directionality": "direction_optional",
      "freshness_policy": {"policy_ref": "freshness.access_review.v1", "time_bound": false, "expected_statuses": ["current", "stale", "unknown"], "max_age_s": 2592000},
      "evidence_requirement": "evidence_required",
      "allowed_fact_statuses": ["accepted"]
    },
    {
      "predicate_id": "route.traffic_exposure",
      "label_zh": "机动车暴露",
      "description": "特定 Traversal 和方向下的机动车暴露等级。",
      "category": "directional_experience",
      "allowed_subject_types": ["named_route", "named_line", "climb", "traversal", "road_section"],
      "value_kind": "enum",
      "enum_values": ["low", "moderate", "high", "variable", "unknown"],
      "scope_requirements": {"traversal_scope": true, "direction_scope": true, "spatial_scope": "optional", "time_window": "optional"},
      "directionality": "direction_specific",
      "freshness_policy": {"policy_ref": "freshness.traffic_exposure.v1", "time_bound": false, "expected_statuses": ["current", "stale", "unknown"], "max_age_s": 7776000},
      "evidence_requirement": "evidence_required",
      "allowed_fact_statuses": ["accepted"]
    },
    {
      "predicate_id": "route.climb_rhythm",
      "label_zh": "爬升节奏",
      "description": "特定 Traversal 上连续、碎坡或台阶式的爬升体验。",
      "category": "directional_experience",
      "allowed_subject_types": ["named_route", "named_line", "climb", "traversal"],
      "value_kind": "enum",
      "enum_values": ["steady", "rolling", "stepped", "punchy", "mixed", "unknown"],
      "scope_requirements": {"traversal_scope": true, "direction_scope": true, "spatial_scope": "optional", "time_window": "none"},
      "directionality": "direction_specific",
      "freshness_policy": {"policy_ref": "freshness.experience_revision.v1", "time_bound": false, "expected_statuses": ["static", "stale", "unknown"], "max_age_s": null},
      "evidence_requirement": "evidence_required",
      "allowed_fact_statuses": ["accepted"]
    },
    {
      "predicate_id": "route.technical_descent",
      "label_zh": "下坡技术性",
      "description": "特定下降 Traversal 的技术难度等级。",
      "category": "directional_experience",
      "allowed_subject_types": ["named_route", "named_line", "climb", "traversal"],
      "value_kind": "enum",
      "enum_values": ["low", "moderate", "high", "unknown"],
      "scope_requirements": {"traversal_scope": true, "direction_scope": true, "spatial_scope": "optional", "time_window": "none"},
      "directionality": "direction_specific",
      "freshness_policy": {"policy_ref": "freshness.experience_revision.v1", "time_bound": false, "expected_statuses": ["static", "stale", "unknown"], "max_age_s": null},
      "evidence_requirement": "evidence_required",
      "allowed_fact_statuses": ["accepted"]
    },
    {
      "predicate_id": "route.supply_availability",
      "label_zh": "补给可用性",
      "description": "路线或目的地周边补给的结构化可用性。",
      "category": "static_curated_fact",
      "allowed_subject_types": ["named_route", "named_line", "destination", "classic_ride", "traversal"],
      "value_kind": "enum",
      "enum_values": ["none", "limited", "reliable", "seasonal", "unknown"],
      "scope_requirements": {"traversal_scope": false, "direction_scope": false, "spatial_scope": "optional", "time_window": "optional"},
      "directionality": "not_directional",
      "freshness_policy": {"policy_ref": "freshness.supply_review.v1", "time_bound": false, "expected_statuses": ["current", "stale", "unknown"], "max_age_s": 2592000},
      "evidence_requirement": "evidence_required",
      "allowed_fact_statuses": ["accepted"]
    },
    {
      "predicate_id": "route.shade_exposure",
      "label_zh": "遮阴暴露",
      "description": "路线范围内遮阴程度的经验证归类。",
      "category": "directional_experience",
      "allowed_subject_types": ["named_route", "named_line", "climb", "traversal", "road_section"],
      "value_kind": "enum",
      "enum_values": ["none", "partial", "high", "variable", "unknown"],
      "scope_requirements": {"traversal_scope": false, "direction_scope": false, "spatial_scope": "optional", "time_window": "optional"},
      "directionality": "direction_optional",
      "freshness_policy": {"policy_ref": "freshness.experience_seasonal.v1", "time_bound": false, "expected_statuses": ["current", "stale", "unknown"], "max_age_s": 15552000},
      "evidence_requirement": "evidence_required",
      "allowed_fact_statuses": ["accepted"]
    },
    {
      "predicate_id": "route.wind_exposure",
      "label_zh": "风暴露",
      "description": "特定方向 Traversal 的常态风暴露，不替代当天风况快照。",